ccn,provider_name,state,total_events,fine_count,fine_total_dollars,payment_denial_count,most_recent_penalty
015019,MERRY WOOD LODGE,AL,2,1,182968.0,1,2024-09-01
015032,DIVERSICARE OF FOLEY,AL,1,1,10065.0,0,2023-06-19
015048,CULLMAN HEALTH CARE CENTER,AL,1,1,26982.0,0,2023-10-19
015060,NORTHGATE HEALTH AND REHABILITATION CENTER,AL,4,3,17346.0,1,2025-05-09
015075,"SUMMERFORD HEALTH AND REHAB, LLC",AL,3,3,25568.0,0,2024-04-24
015076,FAIR HAVEN,AL,10,10,31615.0,0,2023-10-30
015097,"SOUTH HEALTH AND REHABILITATION, LLC",AL,3,2,8569.0,1,2023-08-24
015104,SOUTHLAND NURSING HOME,AL,1,1,5244.0,0,2023-12-18
015115,"CORDOVA HEALTH AND REHABILITATION, LLC",AL,2,1,76242.0,1,2024-11-20
015119,BELLWAY HEALTH AND REHABILITATION CENTER,AL,1,1,203450.0,0,2024-07-15
015120,"NHC HEALTHCARE, ANNISTON",AL,1,1,11057.0,0,2024-10-26
015132,DIVERSICARE OF OXFORD,AL,1,1,111900.0,0,2026-04-09
015133,MAGNOLIA RIDGE,AL,1,1,392125.0,0,2025-03-19
015134,BIRMINGHAM NURSING AND REHABILITATION CENTER EAST,AL,6,5,24834.0,1,2024-05-13
015136,FALKVILLE REHABILITATION AND HEALTHCARE CENTER,AL,3,2,146615.0,1,2025-09-02
015144,THE HEALTHCARE CENTER AT BUCK CREEK,AL,3,2,16801.0,1,2024-05-03
015155,"RIDGEVIEW HEALTH SERVICES, INC",AL,1,1,8788.0,0,2025-08-08
015159,DIVERSICARE OF ONEONTA,AL,2,1,9318.0,1,2023-07-23
015175,WESLEY PLACE ON HONEYSUCKLE,AL,12,12,48689.0,0,2024-03-23
015178,GREENE COUNTY NURSING HOME,AL,1,1,13635.0,0,2023-10-10
015186,"GLEN HAVEN HEALTH AND REHABILITATION, LLC",AL,1,1,81335.0,0,2023-07-26
015197,LAFAYETTE EXTENDED CARE,AL,1,1,4558.0,0,2024-01-30
015199,CROWNE HEALTH CARE OF EUFAULA,AL,2,1,42884.0,1,2024-09-20
015206,DECATUR HEALTH & REHAB CENTER,AL,4,4,25367.0,0,2025-02-03
015217,BIRMINGHAM NURSING AND REHABILITATION CTR LLC,AL,3,2,74848.0,1,2025-10-29
015223,NORTHSIDE HEALTH CARE,AL,1,1,221520.0,0,2025-07-26
015320,ENTERPRISE HEALTH & REHABILITATION CENTER,AL,2,1,85230.0,1,2026-01-18
015369,OAKS ON PARKWOOD SKILLED NURSING FACILITY,AL,1,1,17345.0,0,2025-09-28
015372,REGENCY HEALTH CARE AND REHABILITATION CENTER,AL,3,2,16801.0,1,2024-08-21
015379,MOBILE NURSING AND REHABILITATION CENTER,AL,1,1,13520.0,0,2025-06-27
015397,WINDSOR HOUSE,AL,1,1,266231.0,0,2023-08-24
015406,"Greenway Health and Rehabilitation Center, LLC",AL,10,8,78421.0,2,2025-04-15
015408,"WALKER REHABILITATION CENTER, INC",AL,1,1,235127.0,0,2024-11-30
015420,CUMBERLAND HEALTH AND REHAB,AL,1,1,238745.0,0,2024-06-03
015429,KENSINGTON HEALTH AND REHABILITATION,AL,1,1,4558.0,0,2024-02-06
015433,ST MARTIN'S IN THE PINES,AL,1,0,0.0,1,2025-07-18
015453,"COLUMBIANA HEALTH AND REHABILITATION, LLC",AL,1,1,8018.0,0,2024-04-18
015455,ELITE NURSING AND REHABILITATION CARE CENTER,AL,1,1,6682.0,0,2024-08-13
015458,THE HEALTH CENTER AT RESEARCH PARK,AL,2,1,69011.0,1,2024-06-18
015463,KNOLLWOOD HEALTHCARE,AL,5,4,318070.0,1,2025-03-27
015464,"ASPIRE PHYSICAL RECOVERY CENTER AT HOOVER, LLC",AL,1,1,15593.0,0,2023-06-25
015467,CAVALIER HEALTHCARE OF TRUSSVILLE,AL,7,7,42603.0,0,2024-02-20
015468,ASPIRE PHYSICAL RECOVERY CENTER AT CAHABA RIVER,AL,1,1,16801.0,0,2024-01-12
025018,POLARIS TRANSITIONAL CARE,AK,1,1,109382.0,0,2023-09-01
025020,Denali Center,AK,1,1,15935.0,0,2026-01-20
025025,CENTENNIAL POST ACUTE,AK,4,3,316369.0,1,2025-12-24
025036,Polaris Extended Care,AK,5,4,238053.0,1,2025-11-26
025037,YUKON KUSKOKWIM ELDER'S HOME,AK,1,1,10117.0,0,2025-01-31
025038,MAPLE SPRINGS OF WASILLA,AK,1,0,0.0,1,2024-06-21
025039,MAPLE SPRINGS OF PALMER,AK,3,3,75669.0,0,2025-03-27
035014,Desert Terrace Healthcare Center,AZ,1,1,1300.0,0,2025-11-21
035062,DESERT HAVEN CARE CENTER,AZ,2,2,77018.0,0,2025-12-17
035072,PHOENIX MOUNTAIN POST ACUTE,AZ,1,1,8018.0,0,2024-06-11
035091,HAVEN OF FLAGSTAFF,AZ,1,1,13098.0,0,2025-03-14
035092,Bella Vita Health and Rehabilitation Center,AZ,1,1,8278.0,0,2025-11-06
035099,SANDSTONE OF TUCSON REHAB CENTRE,AZ,2,2,55090.0,0,2026-04-03
035101,CHANDLER POST ACUTE AND REHABILITATION,AZ,1,1,10358.0,0,2025-11-20
035107,HAVEN OF PHOENIX,AZ,1,1,12735.0,0,2025-12-16
035110,Sun West Choice Healthcare & Rehab,AZ,1,1,4838.0,0,2023-08-28
035118,HAVEN OF CAMP VERDE,AZ,1,1,18252.0,0,2026-02-11
035134,RIM COUNTRY HEALTH & RETIREMENT COMMUNITY,AZ,1,1,10358.0,0,2025-02-12
035135,Montecito Post Acute Care and Rehabilitation,AZ,1,1,8278.0,0,2025-05-20
035136,LIFE CARE CENTER OF SIERRA VISTA,AZ,2,2,55881.0,0,2024-10-18
035139,HAVEN OF SHOW LOW,AZ,2,2,46852.0,0,2025-04-16
035143,LIFE CARE CENTER OF SCOTTSDALE,AZ,1,1,6414.0,0,2024-09-12
035146,Life Care Center of Paradise Valley,AZ,1,1,72147.0,0,2023-06-30
035147,VILLA MARIA POST ACUTE AND REHABILITATION,AZ,1,1,8018.0,0,2024-04-12
035158,Prescott Village Nursing & Rehabilitation,AZ,1,1,8278.0,0,2025-03-25
035159,Horizon Post Acute and Rehabilitation Center,AZ,1,1,10985.0,0,2025-10-31
035164,DESERT BLOSSOM HEALTH & REHAB CENTER,AZ,1,1,8278.0,0,2025-06-02
035172,HAVEN OF SAFFORD,AZ,1,1,15210.0,0,2026-02-10
035174,PARK AVENUE HEALTH AND REHABILITATION CENTER,AZ,1,1,25116.0,0,2024-08-01
035175,DESERT PEAK CARE CENTER,AZ,3,2,64873.0,1,2025-01-10
035189,LA CANADA CARE CENTER,AZ,1,1,12735.0,0,2026-01-21
035193,Citrus Heights Respiratory and Rehabilitation,AZ,1,1,5324.0,0,2023-07-03
035197,Haven of Yuma,AZ,1,1,9302.0,0,2023-06-23
035216,CARING HOUSE,AZ,3,2,28695.0,1,2025-09-18
035217,REHAB AT SCOTTSDALE VILLAGE SQUARE,AZ,11,11,199344.0,0,2024-08-21
035234,Arizona State Veteran Home-Phx,AZ,4,3,23296.0,1,2024-12-10
035240,HAVEN OF LAKE HAVASU,AZ,1,1,8018.0,0,2024-10-17
035242,DR GUY GORMAN SR CARE HOME,AZ,4,2,127634.0,2,2025-07-25
035244,Prescott Valley Nursing & Rehabilitation,AZ,1,1,8278.0,0,2025-07-11
035250,Immanuel Campus Of Care,AZ,2,2,18529.0,0,2025-01-31
035254,WINSLOW CAMPUS OF CARE,AZ,5,5,117139.0,0,2024-09-26
035255,Palm Valley Post Acute,AZ,1,1,82607.0,0,2025-02-06
035264,Sun Health La Loma Care Center,AZ,1,1,8278.0,0,2025-10-28
035273,SPLENDIDO AT RANCHO VISTOSO,AZ,1,1,8018.0,0,2024-09-10
035276,OASIS PAVILION NURSING & REHABILITATION CENTER,AZ,3,3,13761.0,0,2023-08-28
035277,HAVEN OF LAKESIDE,AZ,1,1,8278.0,0,2025-06-11
035280,SANTE OF MESA,AZ,1,1,3146.0,0,2023-09-05
035299,NORTHPARK HEALTH AND REHABILITATION OF CASCADIA,AZ,1,1,12735.0,0,2026-01-23
035302,Diamondback Healthcare Center,AZ,2,2,5073.0,0,2024-01-08
045125,BUTTERFIELD TRAIL VILLAGE,AR,2,1,58006.0,1,2025-03-06
045140,The Springs Searcy,AR,1,1,12735.0,0,2026-03-26
045143,"Concordia Nursing & Rehab, LLC",AR,3,2,123918.0,1,2025-05-06
045151,THE GREEN HOUSE COTTAGES OF WALNUT RIDGE,AR,1,1,8193.0,0,2023-12-21
045168,"JOHNSON COUNTY HEALTH AND REHAB, LLC",AR,1,1,8281.0,0,2025-03-12
045170,THE GREEN HOUSE COTTAGES OF BELLE MEADE,AR,1,1,13870.0,0,2024-12-19
045172,Dermott City Nursing Home,AR,2,2,31889.0,0,2025-12-23
045176,"THE WOODS, A NIGHTINGALE COMMUNITY",AR,1,1,15940.0,0,2025-07-03
045177,"CRESTPARK DEWITT, LLC",AR,2,2,9438.0,0,2023-12-11
045178,"PIGGOTT HEALTHCARE & SENIOR LIVING, LLC",AR,1,1,12649.0,0,2023-12-15
045190,NIGHTINGALE AT CROSSETT,AR,1,1,12353.0,0,2024-09-19
045191,LAKE FOREST SENIOR LIVING AT HOT SPRINGS VILLAGE,AR,1,1,13627.0,0,2024-09-26
045192,The Springs of Mt Vista,AR,1,1,32965.0,0,2024-09-27
045194,THE COTTAGES AT TEXARKANA,AR,1,1,28022.0,0,2025-03-28
045201,CHAPEL WOODS HEALTH AND REHABILITATION,AR,1,1,8281.0,0,2025-05-13
045211,THE SPRINGS OF TEXARKANA,AR,1,1,14665.0,0,2025-02-26
045216,TWIN RIVERS REHABILITATION AND HEALTHCARE CENTER,AR,1,1,12335.0,0,2025-08-28
045217,THE SPRINGS OF AVALON,AR,1,1,8416.0,0,2025-08-14
045222,WOODRUFF COUNTY HEALTH CENTER,AR,1,1,8278.0,0,2025-09-18
045228,MAPLE HEALTHCARE,AR,2,1,52000.0,1,2025-06-05
045236,DES ARC NURSING AND REHABILITATION CENTER,AR,1,1,8021.0,0,2024-01-12
045239,BELLE VIEW ESTATES REHABILITATION AND CARE CENTER,AR,1,1,7443.0,0,2023-09-25
045243,THE PINES NURSING AND REHABILITATION CENTER,AR,1,1,13863.0,0,2024-08-29
045245,CONWAY HEALTHCARE AND REHABILITATION CENTER,AR,1,1,25483.0,0,2024-05-06
045259,The Blossoms at Woodland Hills Rehab & Nursing Cen,AR,1,1,133616.0,0,2026-04-21
045270,ARBOR OAKS HEALTHCARE AND REHABILITATION CENTER,AR,2,1,8018.0,1,2024-06-27
045271,OAK RIDGE HEALTH AND REHABILITATION,AR,2,2,74825.0,0,2023-12-29
045280,TWIN LAKES THERAPY AND LIVING,AR,3,2,25678.0,1,2024-11-01
045284,POCAHONTAS HEALTHCARE AND REHABILITATION CENTER,AR,1,1,9307.0,0,2025-06-20
045290,"DARDANELLE NURSING AND REHABILITATION CENTER,INC",AR,1,1,9113.0,0,2025-06-27
045295,The Blossoms at Berryville Rehab & Nursing Center,AR,2,2,22880.0,0,2026-04-23
045303,"CRESTPARK STUTTGART, LLC",AR,1,1,25728.0,0,2024-01-12
045305,SOUTHERN TRACE REHABILITATION AND CARE CENTER,AR,2,1,46053.0,1,2025-03-05
045306,THE SPRINGS OF HILLCREST,AR,2,1,9537.0,1,2023-07-07
045313,THE BLOSSOMS AT CONWAY REHAB & NURSING CENTER,AR,1,1,8021.0,0,2024-08-22
045314,BARNES HEALTHCARE,AR,2,1,34623.0,1,2023-12-28
045315,Lakeside Health and Rehab,AR,2,2,22922.0,0,2025-07-25
045317,WOOD-LAWN HEIGHTS,AR,1,1,12695.0,0,2024-05-22
045323,THE BLOSSOMS AT WHITE RIVER REHAB & NURSING CENTER,AR,1,1,14316.0,0,2025-06-26
045334,THE BLOSSOMS AT NEWPORT REHAB & NURSING CENTER,AR,1,1,7443.0,0,2023-09-28
045341,MEADOWVIEW HEALTHCARE AND REHAB,AR,4,2,18446.0,2,2024-10-16
045359,THE BLOSSOMS AT CUMBERLAND REHAB & NURSING CENTER,AR,1,1,23023.0,0,2025-01-16
045363,COVINGTON COURT HEALTH AND REHABILITATION CENTER,AR,1,1,12196.0,0,2023-06-22
045366,HERITAGE SQUARE HEALTHCARE CENTER,AR,1,1,7913.0,0,2025-05-08
045370,Alma Nursing and Rehab,AR,1,1,26195.0,0,2026-03-10
045371,"WESTWOOD HEALTH AND REHAB, INC",AR,1,1,13871.0,0,2025-01-31
045376,"Sherwood Nursing & Rehabilitation Center, Inc",AR,2,2,33576.0,0,2025-12-11
045377,The Green House Cottages of Southern Hills,AR,2,2,47814.0,0,2024-04-30
045379,Pine Bluff Transitional Care,AR,7,6,97971.0,1,2025-04-18
045380,ST ELIZABETH'S PLACE,AR,2,2,21828.0,0,2026-04-02
045384,Woodbriar Nursing Home,AR,4,4,16467.0,0,2024-02-20
045391,THREE RIVERS HEALTH AND REHABILITATION CENTER,AR,1,1,24457.0,0,2023-08-18
045394,RECTOR NURSING AND REHAB,AR,1,1,14069.0,0,2025-02-26
045402,"HIGHLANDS OF BELLA VISTA HEALTH & REHAB, LLC",AR,1,1,8055.0,0,2023-11-10
045404,THE SPRINGS OF RED OAK,AR,1,1,14935.0,0,2024-02-08
045408,ALCOA PINES HEALTH AND REHABILITATION,AR,1,1,7443.0,0,2023-07-27
045412,"WILLOWBEND HEALTH AND REHABILITATION, LLC",AR,3,2,30771.0,1,2025-02-06
045421,Ashley Rehabilitation and Health Care Center,AR,1,1,65473.0,0,2024-11-01
045430,The Springs of Brinkley,AR,2,2,22422.0,0,2026-02-23
045433,CORNING THERAPY AND LIVING CENTER,AR,1,1,8021.0,0,2024-08-08
045435,"Jamestown Nursing And Rehab, LLC",AR,3,3,77541.0,0,2024-12-11
045439,GOSNELL HEALTH AND REHAB,AR,1,1,13627.0,0,2024-09-19
045440,HARRIS HEALTH AND REHAB,AR,1,1,8281.0,0,2025-05-14
045442,CAVALIER HEALTHCARE OF ENGLAND,AR,2,2,18356.0,0,2024-01-31
045451,Creekside at the Springs,AR,1,1,15915.0,0,2024-02-09
045456,PINK BUD HOME FOR THE GOLDEN YEARS,AR,1,1,28561.0,0,2025-05-22
045458,The Blossoms at Breckenridge Rehab & Nursing Cente,AR,2,2,28654.0,0,2025-09-12
045460,"COLONEL GLENN HEALTH AND REHAB, LLC",AR,1,1,78000.0,0,2025-12-04
045463,"BELVEDERE NURSING AND REHABILITATION CENTER, LLC",AR,3,2,206908.0,1,2025-03-14
045465,"APPLE CREEK HEALTH AND REHAB, LLC",AR,1,1,8410.0,0,2025-01-09
045474,THE GREEN HOUSE COTTAGES OF NORTHWEST ARKANSAS,AR,1,1,705.0,0,2023-10-17
045477,"Monette Manor, LLC",AR,6,6,24309.0,0,2024-02-20
055002,COUNTRY MANOR HEALTHCARE,CA,1,1,8018.0,0,2023-11-27
055003,"EUREKA REHABILITATION & WELLNESS CENTER, LP",CA,1,1,8416.0,0,2024-08-14
055008,EDGEMOOR HOSPITAL,CA,1,1,41895.0,0,2026-02-27
055011,RIVER VIEW POST ACUTE,CA,1,0,0.0,1,2024-07-30
055032,THE EARLWOOD,CA,2,2,30531.0,0,2025-12-31
055036,Maple Healthcare Center,CA,8,6,176644.0,2,2024-07-11
055041,The Beach Post-Acute,CA,2,2,139865.0,0,2024-04-22
055045,RIVIERA HEALTHCARE CENTER,CA,1,1,9110.0,0,2025-02-21
055052,CALIFORNIA POST-ACUTE CARE,CA,1,1,33120.0,0,2025-05-13
055060,WESTWOOD POST ACUTE CARE,CA,2,2,110919.0,0,2025-08-01
055064,COTTONWOOD CANYON HEALTHCARE CENTER,CA,2,2,25423.0,0,2026-02-12
055070,SEACREST POST-ACUTE CARE  CENTER,CA,3,2,109708.0,1,2025-08-31
055072,ROSECRANS CARE CENTER,CA,1,1,4587.0,0,2023-06-26
055076,Spring Valley Post Acute LLC,CA,15,15,82256.0,0,2025-09-26
055077,CORAL COVE POST ACUTE,CA,5,3,118978.0,2,2025-08-15
055084,RIVERBANK POST-ACUTE,CA,3,2,73295.0,1,2025-03-15
055107,BANCROFT HEALTHCARE CENTER,CA,1,0,0.0,1,2025-08-08
055111,FOUNTAIN VIEW SUBACUTE AND NURSING CENTER,CA,2,1,24531.0,1,2024-06-28
055114,Arbor Hills Nursing Center,CA,1,1,12831.0,0,2024-11-01
055126,CHINO VALLEY HEALTH CARE CENTE,CA,1,1,10361.0,0,2025-05-01
055136,BERKLEY WEST HEALTHCARE CENTER,CA,1,1,101046.0,0,2024-12-22
055141,Madera Post Acute Center,CA,2,2,29517.0,0,2025-07-10
055146,NORTH VALLEY NURSING CENTER,CA,2,1,64102.0,1,2025-03-28
055147,MADERA REHABILITATION & NURSING CENTER,CA,5,3,373733.0,2,2025-08-14
055150,DIABLO VALLEY POST ACUTE,CA,1,1,46800.0,0,2025-12-03
055155,OCEAN POINTE HEALTHCARE CENTER,CA,2,1,55450.0,1,2024-03-15
055157,VIRGIL REHABILITATION & SKILLED NURSING CENTER,CA,1,0,0.0,1,2025-07-29
055167,VERNON HEALTHCARE CENTER,CA,5,3,178438.0,2,2025-04-10
055170,PICO RIVERA HEALTHCARE CENTER,CA,1,1,26588.0,0,2024-01-11
055182,LEMON GROVE CARE AND REHABILITATION CENTER,CA,1,1,7443.0,0,2023-07-12
055185,GARDEN CITY HEALTHCARE CENTER,CA,3,3,35153.0,0,2025-11-24
055189,Greenfield Care Center of Fairfield,CA,6,4,455702.0,2,2026-02-18
055191,Madera Care Center,CA,8,8,41597.0,0,2024-01-08
055192,PROVIDENCE ST ELIZABETH CARE CENTER,CA,2,2,54032.0,0,2025-11-25
055199,HORIZON HEALTH & SUBACUTE CENTER,CA,1,1,22913.0,0,2024-03-01
055201,OAK GROVE POST ACUTE,CA,5,5,83719.0,0,2024-02-20
055202,ROSEMEAD HEALTHCARE CENTER,CA,2,2,10572.0,0,2024-08-05
055206,PLAZA HEALTHCARE CENTER,CA,2,2,4587.0,0,2023-08-21
055213,Rialto Post Acute Center,CA,3,2,23621.0,1,2026-01-08
055222,Springs Road Healthcare,CA,2,2,9090.0,0,2023-06-26
055240,WATSONVILLE NURSING CENTER,CA,1,1,44488.0,0,2023-08-22
055241,WILLOW PASS HEALTHCARE CENTER,CA,2,1,45702.0,1,2024-04-11
055253,ST. JOHN OF GOD RETIREMENT,CA,4,3,124440.0,1,2024-05-22
055287,VALLEY PALMS CARE CENTER,CA,3,2,33681.0,1,2025-01-22
055288,AUTUMN HILLS HEALTH CARE CENTER,CA,2,1,14387.0,1,2026-02-05
055293,SANTA ANITA CONVALESCENT HOSPITAL,CA,5,4,234187.0,1,2025-06-17
055297,THE SPRINGS POST-ACUTE,CA,2,1,66866.0,1,2025-01-02
055305,SHERWOOD HEALTHCARE CENTER,CA,1,1,1748.0,0,2023-06-26
055307,"Desert Canyon Post Acute, LLC",CA,1,0,0.0,1,2024-06-20
055308,Elk Grove Post Acute,CA,1,1,8824.0,0,2024-02-16
055315,CAMINO RIDGE POST-ACUTE,CA,1,1,8428.0,0,2025-07-14
055316,MOUNTAIN VIEW HEALTHCARE CENTER,CA,1,1,54912.0,0,2024-06-04
055318,SKYLINE HEALTHCARE CENTER - SAN JOSE,CA,1,1,105089.0,0,2023-12-11
055322,THE PAVILION AT OCEAN POINT,CA,1,0,0.0,1,2026-03-02
055329,VILLA SERENA HEALTHCARE CENTER,CA,1,1,26685.0,0,2025-01-18
055330,ADVANCED REHAB CENTER OF TUSTIN,CA,1,1,37182.0,0,2024-07-12
055331,"SAN RAFAEL HEALTHCARE & WELLNESS CENTER, LP",CA,2,1,8278.0,1,2025-03-20
055338,SAGE POST ACUTE,CA,1,1,4938.0,0,2024-02-20
055341,Pasadena Palace TCU,CA,1,1,27808.0,0,2025-05-16
055342,"Thousand Oaks Post Acute, LLC",CA,1,1,20703.0,0,2025-12-17
055350,CULVER WEST HEALTH CENTER,CA,1,1,117037.0,0,2023-09-15
055353,SHORELINE HEALTHCARE CENTER,CA,1,1,41629.0,0,2025-04-18
055356,OCEANVIEW POST ACUTE,CA,2,1,3147.0,1,2024-03-20
055361,VISTA PACIFICA CONVALESCENT HOSPITAL,CA,1,1,52611.0,0,2024-02-12
055364,LONG BEACH HEALTHCARE CENTER,CA,4,3,81538.0,1,2026-03-16
055372,VALLEY VIEW POST ACUTE,CA,2,1,24668.0,1,2023-11-22
055387,EDGEWATER SKILLED NURSING CENTER,CA,4,3,62511.0,1,2024-12-04
055410,BRIGHTON POST ACUTE,CA,1,0,0.0,1,2025-04-01
055412,VACAVILLE RANCH POST ACUTE,CA,7,7,127689.0,0,2024-02-20
055417,SAYLOR LANE HEALTHCARE CENTER,CA,1,1,1748.0,0,2023-06-26
055423,"MANNING GARDENS CARE CENTER, INC",CA,1,1,12000.0,0,2025-02-06
055435,THE VILLAS AT SARATOGA SKILLED NSG & ASSISTED LVG,CA,2,2,40323.0,0,2025-11-25
055443,WEST VALLEY POST ACUTE,CA,4,2,71200.0,2,2024-06-07
055449,COVINA REHABILITATION CENTER,CA,4,3,29228.0,1,2025-05-30
055457,INTERCOMMUNITY HEALTHCARE & REHABILITATION CENTER,CA,1,1,20654.0,0,2024-08-23
055461,CALIFORNIA POST ACUTE,CA,9,5,227180.0,4,2025-07-26
055466,THE SEQUOIAS,CA,1,1,12703.0,0,2023-10-30
055473,NEW VISTA POST-ACUTE CARE CENTER,CA,9,8,52129.0,1,2025-05-08
055474,WOODCREST POST ACUTE & REHABILITATION,CA,1,1,12500.0,0,2024-04-26
055489,SHASTA VIEW CARE CENTER,CA,2,2,189423.0,0,2024-07-24
055493,Mid-Town Oaks Post-Acute,CA,1,1,15593.0,0,2023-09-14
055516,CHICO TERRACE CARE CENTER,CA,4,4,34573.0,0,2024-01-22
055519,DOWNEY POST ACUTE,CA,1,1,13575.0,0,2024-08-09
055523,GLENDALE POST ACUTE CENTER,CA,5,4,161982.0,1,2025-06-12
055525,CRENSHAW NURSING HOME,CA,4,3,47972.0,1,2025-03-21
055526,INGLEWOOD HEALTH CARE CENTER,CA,3,2,32261.0,1,2026-01-14
055527,LOS PALOS POST-ACUTE CARE CENTER,CA,2,1,6351.0,1,2025-05-09
055539,ARTESIA CHRISTIAN HOME INC.,CA,2,1,98079.0,1,2024-10-25
055540,SANTA MONICA HEALTH CARE CENTER,CA,1,0,0.0,1,2023-12-28
055551,SEQUOIA TRANSITIONAL CARE,CA,3,2,60297.0,1,2025-12-31
055559,BAY CREST CARE CENTER,CA,7,4,124336.0,3,2025-11-03
055562,NILES CANYON POST ACUTE,CA,1,1,2098.0,0,2023-06-26
055566,Coastal View Healthcare Center,CA,1,1,8278.0,0,2025-04-28
055568,SIERRA VALLEY REHAB CENTER,CA,1,1,8190.0,0,2024-10-25
055571,BUENA PARK NURSING CENTER,CA,2,1,8278.0,1,2025-10-30
055581,JURUPA HILLS POST ACUTE,CA,3,3,60945.0,0,2024-09-11
055601,PARKVIEW JULIAN HEALTHCARE CENTER,CA,2,1,59560.0,1,2025-02-27
055608,PRIMROSE POST-ACUTE,CA,2,1,16801.0,1,2024-05-10
055612,FEATHER RIVER CARE CENTER,CA,2,1,59794.0,1,2024-01-10
055617,PASADENA GROVE HEALTH CENTER,CA,1,1,4233.0,0,2023-08-07
055619,Las Colinas Post Acute,CA,1,1,70925.0,0,2023-11-02
055626,HEALTHCARE CENTRE OF FRESNO,CA,4,3,88049.0,1,2024-10-03
055632,Grossmont Post Acute Care,CA,1,1,11466.0,0,2024-08-01
055650,Highland Care Center of Redlands,CA,1,1,12931.0,0,2023-07-26
055656,OAKWOOD HEALTHCARE CENTER,CA,5,3,76946.0,2,2025-11-06
055664,YORK HEALTHCARE & WELLNESS CENTRE,CA,2,1,99206.0,1,2023-12-07
055670,BROADWAY MANOR CARE CENTER,CA,2,1,36090.0,1,2025-03-18
055674,HEALTHCARE CENTER OF ORANGE COUNTY,CA,2,1,8278.0,1,2025-10-09
055677,PITTSBURG SKILLED NURSING CENTER,CA,1,1,10793.0,0,2025-03-06
055697,COSTA DEL SOL HEALTHCARE,CA,1,1,38181.0,0,2024-11-06
055704,ANGELS NURSING HEALTH CENTER,CA,3,2,71566.0,1,2024-07-16
055706,THE ORCHARD - POST ACUTE CARE,CA,2,2,26400.0,0,2025-04-29
055715,KYAKAMEENA CARE CENTER,CA,8,8,38848.0,0,2023-10-17
055718,MONTCLAIR MANOR CARE CENTER,CA,1,1,2098.0,0,2023-06-26
055728,SANTA CLARITA POST-ACUTE CARE CENTER,CA,4,3,118170.0,1,2024-07-02
055737,SUNNY HILLS POST ACUTE,CA,3,2,89134.0,1,2025-04-24
055742,HARBOR VILLA CARE CENTER,CA,1,1,8824.0,0,2023-06-28
055753,LONGWOOD MANOR CONV.HOSPITAL,CA,4,3,24465.0,1,2024-02-20
055755,SHARON CARE CENTER,CA,1,1,49162.0,0,2023-10-06
055758,COTTAGE CREST POST ACUTE,CA,3,3,66245.0,0,2024-06-11
055760,"ALHAMBRA HEALTHCARE & WELLNESS CENTRE, LP",CA,1,1,17388.0,0,2024-04-05
055764,WHITTIER PACIFIC CARE CENTER,CA,1,0,0.0,1,2024-01-26
055797,GILROY HEALTHCARE CENTER,CA,1,1,69735.0,0,2025-06-17
055806,VILLA LAS PALMAS HEALTHCARE CENTER,CA,3,2,33732.0,1,2025-04-17
055807,SHASTA HEALTHCARE,CA,2,2,84526.0,0,2025-09-12
055809,ST ANTHONY CARE CENTER,CA,1,1,51355.0,0,2024-01-12
055817,MONTE VISTA HEALTHCARE CENTER,CA,2,2,5244.0,0,2023-06-26
055839,SAN LUIS CARE CENTER,CA,1,1,46118.0,0,2024-01-30
055850,PINE RIDGE CARE CENTER,CA,1,1,7542.0,0,2023-07-21
055854,SANTA ROSA POST ACUTE,CA,1,1,10166.0,0,2025-01-28
055855,Arden Park Post Acute,CA,2,2,33586.0,0,2025-02-21
055858,RANCHO SECO CARE CENTER,CA,3,3,497648.0,0,2025-11-25
055862,GOLDEN ROSE CARE CENTER,CA,23,22,175941.0,1,2024-11-26
055866,PLUM TREE CARE CENTER,CA,1,1,8018.0,0,2024-09-24
055870,SUNRAY HEALTHCARE CENTER,CA,6,4,147893.0,2,2026-01-08
055871,COASTAL POST ACUTE,CA,1,1,63850.0,0,2025-03-14
055872,Citrus Nursing Center,CA,1,1,7446.0,0,2023-08-30
055876,"PRINCETON MANOR HEALTHCARE CENTER, LLC",CA,1,0,0.0,1,2025-10-20
055884,CREEKSIDE POST-ACUTE,CA,1,1,20248.0,0,2024-07-18
055887,River Bend Nursing Center,CA,2,1,21879.0,1,2023-12-14
055888,Huntington Valley Healthcare Center,CA,3,2,25470.0,1,2026-02-05
055890,MAGNOLIA POST ACUTE CARE,CA,1,1,117475.0,0,2025-12-11
055894,BROADWAY BY THE SEA,CA,5,5,205642.0,0,2024-11-08
055899,ROYAL PALMS POST ACUTE,CA,4,2,79980.0,2,2024-04-17
055906,RINALDI CONVALESCENT HOSPITAL,CA,1,0,0.0,1,2024-02-06
055916,SEQUOIA VISTA,CA,4,2,46078.0,2,2026-03-02
055932,"FOUR SEASONS HEALTHCARE & WELLNESS CENTER, LP",CA,4,4,87215.0,0,2024-11-12
055952,"TORRANCE CARE CENTER WEST, INC",CA,4,3,45047.0,1,2026-02-11
055954,National City Post Acute,CA,1,1,15652.0,0,2024-08-22
055959,WATSONVILLE POST ACUTE CENTER,CA,1,1,8018.0,0,2024-03-08
055960,La Crescenta Healthcare Center,CA,1,1,17122.0,0,2025-07-10
055963,THE AVENUES TRANSITIONAL CARE CENTER,CA,1,1,12685.0,0,2025-10-02
055964,FRIENDSHIP MANOR NURSING & REHAB CENTER,CA,4,4,297367.0,0,2025-04-25
055977,KENNEDY CARE CENTER,CA,2,1,38272.0,1,2025-03-20
055979,FRANCISCAN POST-ACUTE CARE CENTER,CA,1,1,9110.0,0,2025-01-13
055984,"ANAHEIM HEALTHCARE CENTER, LLC",CA,1,1,9278.0,0,2025-05-22
055988,GOLDEN MERCED CARE CENTER,CA,5,5,103467.0,0,2023-09-01
055989,HERITAGE MANOR,CA,1,1,17940.0,0,2025-03-28
055992,WEST COVINA HEALTHCARE CENTER,CA,5,3,78978.0,2,2024-03-28
055995,North Long Beach Post Acute,CA,3,2,74998.0,1,2026-02-25
056007,Pacific Care Nursing Center,CA,3,3,100013.0,0,2025-01-24
056008,GUARDIAN REHABILITATION HOSPITAL,CA,1,1,32040.0,0,2024-06-20
056023,AVALON VILLA CARE CENTER,CA,6,3,111937.0,3,2025-11-21
056031,SUNLAND POST ACUTE,CA,7,4,258816.0,3,2025-05-05
056035,SHAFTER NURSING CARE,CA,2,2,27439.0,0,2024-11-19
056039,MIRAGE POST ACUTE,CA,3,3,153991.0,0,2025-07-22
056042,"BAY VISTA HEALTHCARE & WELLNESS CENTRE, LP",CA,3,2,33030.0,1,2025-04-04
056043,COLONIAL CARE CENTER,CA,7,4,140904.0,3,2026-01-29
056052,EDEN HEALTHCARE CENTER,CA,1,1,30870.0,0,2024-02-06
056053,HAVEN POST ACUTE,CA,4,3,55737.0,1,2024-03-10
056056,The Meadows on Sunset Post Acute,CA,1,1,21681.0,0,2024-08-09
056063,INFINITY CARE OF EAST LOS ANGELES,CA,2,2,65817.0,0,2025-05-31
056065,SANTA CRUZ POST ACUTE,CA,3,3,160564.0,0,2025-11-06
056066,WOODLAND CARE CENTER,CA,4,2,30972.0,2,2025-04-11
056074,AUTUMN CREEK POST ACUTE,CA,4,2,148521.0,2,2025-10-27
056078,ALTA VIEW POST ACUTE,CA,3,2,174736.0,1,2023-10-22
056079,"GLENDORA GRAND, INC",CA,6,5,168190.0,1,2025-06-26
056080,THE BELLEFONTAINE HEALTHCARE CENTER,CA,1,1,14414.0,0,2025-05-21
056083,WOODS HEALTH SERVICES,CA,2,1,8190.0,1,2024-03-11
056090,BLUE OAK POST-ACUTE,CA,2,2,36384.0,0,2025-12-11
056095,DEVONSHIRE CARE CENTER,CA,1,1,10364.0,0,2025-07-02
056100,CORNERSTONE CARE CENTER,CA,2,2,54444.0,0,2024-06-10
056101,RIVER POINTE POST-ACUTE,CA,1,1,15185.0,0,2026-03-12
056109,WOODLAND POST-ACUTE,CA,1,1,14302.0,0,2024-01-22
056111,GRIFFITH PARK HEALTHCARE CENTER,CA,3,3,63605.0,0,2026-03-25
056114,"EAST TERRACE REHABILITATION & WELLNESS CENTRE, LP",CA,6,6,176430.0,0,2025-04-09
056117,THE ROWLAND,CA,1,1,30421.0,0,2024-06-10
056120,NORTH BAY POST ACUTE,CA,2,2,142877.0,0,2025-04-07
056122,MILLBRAE CARE CENTER,CA,1,1,7045.0,0,2024-01-03
056124,TARZANA HEALTH AND REHABILITATION CENTER,CA,3,2,95254.0,1,2024-10-29
056125,ALAMITOS BELMONT HEALTH AND REHABILITATION,CA,3,3,33017.0,0,2026-01-30
056127,LIVE OAK REHAB CENTER,CA,1,1,27425.0,0,2025-10-10
056129,BURBANK HEALTHCARE & REHAB,CA,3,2,31803.0,1,2026-01-14
056132,GOLDEN SAN ANDREAS CARE  CENTER,CA,4,3,91172.0,1,2024-10-15
056133,WEST HILLS HEALTH AND REHABILITATION  CENTER,CA,5,2,39511.0,3,2025-11-24
056137,THE MEADOWS POST ACUTE,CA,2,1,20790.0,1,2026-03-24
056139,Roseville Point Health & Wellness Center,CA,2,2,16232.0,0,2023-08-21
056150,CATERED MANOR CARE CENTER,CA,4,4,98005.0,0,2025-07-03
056153,NAPA POST ACUTE,CA,2,2,231573.0,0,2026-01-07
056157,ALVARADO CARE CENTER,CA,3,2,90600.0,1,2025-08-22
056158,College Oak Nursing and Rehabilitation Center,CA,1,1,14020.0,0,2025-11-20
056159,SHERMAN VILLAGE HCC,CA,1,1,202260.0,0,2023-08-22
056164,PACIFIC PALMS HEALTHCARE,CA,1,1,19475.0,0,2023-10-06
056166,MEADOW CREEK POST-ACUTE,CA,3,2,43016.0,1,2026-02-24
056168,GRANADA HILLS CONVALESCENT,CA,1,1,8018.0,0,2023-10-02
056174,MID-WILSHIRE HEALTH CARE CNTR,CA,4,3,80922.0,1,2025-07-26
056176,PACIFIC HEIGHTS TRANSITIONAL CARE CENTER,CA,1,1,25490.0,0,2025-01-29
056177,DOUBLE TREE POST ACUTE CARE CENTER,CA,1,1,10842.0,0,2024-10-03
056182,GOLDEN HILL POST ACUTE,CA,1,0,0.0,1,2026-02-19
056183,Valley Healthcare Center,CA,2,1,37151.0,1,2025-03-07
056188,"LONG BEACH CARE CENTER, INC",CA,3,2,54834.0,1,2025-03-06
056190,CHESTNUT RIDGE POST ACUTE LLC,CA,3,2,88851.0,1,2025-11-19
056194,WINDSOR GARDENS CONVALESCENT HOSPITAL,CA,2,1,37882.0,1,2024-01-23
056195,LA BREA REHABILITATION CENTER,CA,1,1,33091.0,0,2024-05-23
056198,KIT CARSON NURSING & REHABILITATION CENTER,CA,4,3,38675.0,1,2026-02-19
056201,BROADWAY HEALTHCARE CENTER,CA,1,1,3145.0,0,2023-09-05
056203,CITY VIEW POST ACUTE,CA,2,1,42528.0,1,2024-01-09
056206,UNIVERSITY PARK HEALTHCARE CENTER,CA,4,4,230606.0,0,2025-02-13
056207,PACIFIC GARDENS NURSING AND REHABILITATION CENTER,CA,1,1,30654.0,0,2025-02-07
056214,RAMONA REHABILITATION AND POST ACUTE CARE CENTER,CA,1,1,8281.0,0,2026-02-13
056215,NORTHBROOK HEALTHCARE CENTER,CA,1,1,9295.0,0,2025-03-05
056218,BELL CONVALESCENT HOSPITAL,CA,4,3,93980.0,1,2024-12-05
056220,BRIARCREST NURSING CENTER,CA,4,2,78684.0,2,2025-03-01
056234,MARLORA POST ACUTE REHAB HOSP,CA,3,2,53643.0,1,2025-11-23
056237,ALDEN TERRACE CONVALESCENT HOSPITAL,CA,1,0,0.0,1,2024-05-20
056238,Solano Post Acute,CA,2,2,73177.0,0,2024-04-10
056243,WESTERN SLOPE HEALTH CENTER,CA,1,1,8412.0,0,2023-09-18
056259,NORTHVINE POSTACUTE CARE,CA,8,8,52520.0,0,2025-07-28
056261,ORCHARDS AT TULARE,CA,3,2,132586.0,1,2024-10-17
056266,KEYSTONE POST-ACUTE,CA,2,1,42764.0,1,2023-11-15
056267,CAMINO HEALTHCARE,CA,1,1,9110.0,0,2025-08-07
056271,MISSION PALMS HEALTHCARE CENTER,CA,1,1,13923.0,0,2024-08-27
056272,SAN FRANCISCO HEALTH CARE,CA,2,2,152404.0,0,2025-02-28
056274,RED BLUFF HEALTH CARE CENTER,CA,12,12,51518.0,0,2023-10-02
