ccn,provider_name,state,total_events,fine_count,fine_total_dollars,payment_denial_count,most_recent_penalty
425395,Brightwater Skilled Nursing Center,SC,1,1,7342.0,0,2023-07-17
425407,The Lodge At Wellmore- Tega Cay,SC,5,5,39971.0,0,2025-02-20
425408,White Oak At North Grove Inc,SC,1,1,10364.0,0,2025-05-15
425412,Retreat at Wellmore of Lexington,SC,1,1,16153.0,0,2025-05-22
425413,Sprenger Health Care of Port Royal,SC,1,1,14069.0,0,2025-11-25
425414,Retreat at Wellmore of Daniel Island,SC,1,1,8281.0,0,2025-09-11
425416,Senior Care of Marion,SC,2,2,24054.0,0,2026-01-28
425418,Kempton Of Charleston,SC,1,1,6032.0,0,2024-02-29
425419,Veteran Village,SC,12,12,47631.0,0,2024-10-11
435009,AVANTARA MILBANK,SD,3,3,55361.0,0,2024-12-18
435020,AVANTARA HURON,SD,1,1,8338.0,0,2024-11-14
435033,Westhills Village Health Care Facility,SD,1,1,13520.0,0,2025-07-08
435035,ROLLING HILLS HEALTHCARE,SD,4,4,94359.0,0,2025-09-29
435036,JENKIN'S LIVING CENTER,SD,2,2,53086.0,0,2024-04-04
435038,TEKAKWITHA LIVING CENTER,SD,3,3,37079.0,0,2024-07-18
435039,AVANTARA NORTON,SD,6,6,153638.0,0,2025-03-05
435040,AVANTARA MOUNTAIN VIEW,SD,1,1,9318.0,0,2024-05-15
435041,ABERDEEN HEALTH AND REHAB,SD,4,4,64270.0,0,2026-02-26
435042,Avera Mother Joseph Manor Retirement Community,SD,1,1,8824.0,0,2024-08-28
435043,SPEARFISH CANYON HEALTHCARE,SD,1,1,14950.0,0,2025-07-09
435044,GOOD SAMARITAN SOCIETY LUTHER MANOR,SD,2,2,26266.0,0,2025-06-18
435045,GOOD SAMARITAN SOCIETY SIOUX FALLS VILLAGE,SD,5,5,72812.0,0,2025-04-24
435046,GOOD SAMARITAN SOCIETY SIOUX FALLS CENTER,SD,1,1,11261.0,0,2023-11-07
435047,AVANTARA PIERRE,SD,1,1,22048.0,0,2025-04-02
435048,AVANTARA GROTON,SD,1,1,6168.0,0,2024-11-26
435051,AVANTARA ARROWHEAD,SD,5,5,105858.0,0,2025-09-11
435054,AVANTARA REDFIELD,SD,3,3,23044.0,0,2025-03-17
435056,WINNER REGIONAL HEALTHCARE CENTER,SD,2,2,13039.0,0,2023-08-24
435058,AVANTARA CLARK CITY,SD,1,1,11057.0,0,2024-09-12
435060,AVANTARA SAINT CLOUD,SD,2,2,38093.0,0,2025-08-13
435064,AVANTARA NORTH,SD,2,2,33768.0,0,2025-08-07
435066,AVERA PRINCE OF PEACE,SD,1,1,12735.0,0,2025-07-02
435068,AVANTARA WATERTOWN,SD,1,1,6368.0,0,2025-03-06
435072,SEVEN SISTERS LIVING CENTER,SD,1,1,12735.0,0,2025-06-25
435074,GOOD SAMARITAN SOCIETY DE SMET,SD,2,2,37327.0,0,2025-10-23
435076,Bethel Lutheran Home,SD,2,2,56430.0,0,2025-07-17
435078,Avera Eureka Health Care Center,SD,1,1,12253.0,0,2025-02-13
435079,UNITED LIVING COMMUNITY,SD,2,2,43975.0,0,2025-07-10
435080,Bethesda Of Beresford,SD,1,1,16088.0,0,2023-10-04
435086,RIVERVIEW HEALTHCARE CENTER,SD,6,6,204860.0,0,2026-03-25
435087,GOOD SAMARITAN SOCIETY CANISTOTA,SD,1,1,9009.0,0,2024-08-20
435088,Centerville Care and Rehab Center Inc,SD,1,1,55059.0,0,2024-04-30
435090,Five Counties Nursing Home,SD,1,1,20703.0,0,2025-03-12
435093,Sun Dial Manor,SD,2,2,24528.0,0,2024-10-29
435094,Wakonda Heritage Manor,SD,1,1,12675.0,0,2025-02-13
435097,LAKE ANDES SENIOR LIVING,SD,2,2,102440.0,0,2024-10-16
435098,GOOD SAMARITAN SOCIETY TYNDALL,SD,3,3,49720.0,0,2025-07-17
435099,Estelline Nursing and Care Center,SD,1,1,16826.0,0,2023-12-14
435100,Sunset Manor Avera Health,SD,2,2,40596.0,0,2025-02-12
435101,GOOD SAMARITAN SOCIETY CANTON,SD,2,2,19615.0,0,2025-01-22
435102,MONUMENT HEALTH STURGIS CARE CENTER,SD,2,2,25958.0,0,2025-06-10
435104,GOOD SAMARITAN SOCIETY NEW UNDERWOOD,SD,2,2,26595.0,0,2025-06-10
435105,Wheatcrest Hills Healthcare Center,SD,4,4,37553.0,0,2025-12-04
435109,FIRESTEEL HEALTHCARE CENTER,SD,6,6,176198.0,0,2025-12-18
435110,Fountain Springs Healthcare,SD,2,2,22526.0,0,2024-08-15
435112,OAKVIEW TERRACE,SD,1,1,10839.0,0,2024-01-18
435114,DIAMOND CARE CENTER,SD,2,2,69512.0,0,2024-06-21
435115,PALISADE HEALTHCARE CENTER,SD,4,4,154946.0,0,2025-11-19
435118,PRAIRIE VIEW HEALTHCARE CENTER,SD,1,1,8512.0,0,2024-06-06
435119,Wilmot Care Center Inc,SD,2,2,28028.0,0,2025-03-06
435120,Pioneer Memorial Nursing Home,SD,1,1,32536.0,0,2023-10-31
435122,St William's Care Center,SD,4,4,146129.0,0,2026-02-19
435124,Good Samaritan Society Miller,SD,2,2,96127.0,0,2026-02-20
435125,Strand-Kjorsvig Community Rest Home,SD,8,8,49964.0,0,2024-09-11
435127,DOW RUMMEL VILLAGE,SD,4,4,105488.0,0,2026-01-08
435129,DELLS NURSING AND REHAB CENTER INC,SD,3,3,173010.0,0,2025-01-16
435130,Bethany Home - Brandon,SD,3,3,51350.0,0,2025-10-21
435132,AURORA BRULE NURSING HOME INC,SD,1,1,17928.0,0,2024-03-06
43A038,SCOTCHMAN LIVING CENTER,SD,3,3,47655.0,0,2025-01-27
43A072,Platte Care Center,SD,1,1,6168.0,0,2024-11-20
43A073,SANFORD CHAMBERLAIN CARE CENTER,SD,4,4,124961.0,0,2025-06-12
43A089,White River Health Care Center,SD,1,1,6168.0,0,2024-11-18
43A098,SANFORD CARE CENTER VERMILLION,SD,1,1,44577.0,0,2024-07-01
43A135,"EASTERN STAR HOME OF SOUTH DAKOTA, INC",SD,1,1,17096.0,0,2024-07-18
43A136,Michael J Fitzmaurice South Dakota Veterans Home,SD,1,1,39293.0,0,2025-05-01
43A137,AVERA BORMANN MANOR,SD,4,4,53884.0,0,2025-06-26
43A138,Medicine Wheel Village,SD,1,1,22636.0,0,2025-11-20
43A139,FLANDREAU SANTEE SIOUX TRIBE CARE CENTER,SD,3,3,27967.0,0,2025-09-30
445008,SISKIN SUBACUTE WEST,TN,1,1,93919.0,0,2023-10-29
445088,"NHC HEALTHCARE, SPRINGFIELD",TN,1,1,122070.0,0,2025-09-15
445094,"NHC HEALTHCARE, LEWISBURG",TN,4,2,379256.0,2,2024-03-14
445105,LEGACY PARK HEALTH AND REHABILITATION,TN,2,1,74633.0,1,2025-02-27
445107,"NHC HEALTHCARE, FT SANDERS",TN,1,1,9770.0,0,2023-11-08
445112,TREVECCA CENTER FOR REHABILITATION AND HEALING LLC,TN,2,2,9325.0,0,2023-06-21
445114,LYONSVIEW HEALTH AND REHABILITATION CENTER,TN,1,1,12038.0,0,2024-07-24
445116,"NHC HEALTHCARE, SMITHVILLE",TN,2,1,228511.0,1,2024-04-11
445123,ASCENSION LIVING ALEXIAN VILLAGE TENNESSEE,TN,3,2,233543.0,1,2025-12-08
445127,"NHC HEALTHCARE, FRANKLIN",TN,1,1,62491.0,0,2025-10-24
445139,MIDTOWN CENTER FOR HEALTH AND REHABILITATION,TN,2,1,188379.0,1,2024-09-05
445141,BRADLEY HEALTH CARE & REHAB,TN,1,1,8999.0,0,2024-02-27
445145,"THE WATERS OF WINCHESTER, LLC",TN,3,3,19325.0,0,2023-07-12
445146,FRANKLIN WELLNESS AND REHABILITATION CENTER,TN,1,1,44469.0,0,2025-06-09
445150,MAJESTIC GARDENS AT MEMPHIS REHAB & SNC,TN,11,9,810404.0,2,2024-05-08
445154,QUALITY CENTER FOR REHABILITATION AND HEALING LLC,TN,2,1,13305.0,1,2023-08-10
445156,BUCHANAN PLACE,TN,1,1,8021.0,0,2024-05-10
445166,THE HEALTH CENTER AT RICHLAND PLACE,TN,1,1,56378.0,0,2024-03-25
445167,LIFE CARE CENTER OF CROSSVILLE,TN,1,1,8824.0,0,2024-08-28
445170,"Antioch TN Opco, LLC",TN,4,3,360721.0,1,2025-10-09
445174,ORCHARD VIEW POST-ACUTE AND REHABILITATION CENTER,TN,5,3,94905.0,2,2025-01-08
445197,Quince Nursing and Rehabilitation Center,TN,1,1,71822.0,0,2025-07-01
445205,CHATTANOOGA HEALTH AND REHAB CENTER,TN,1,1,6509.0,0,2023-10-02
445209,SPRING CITY CARE AND REHABILITATION CENTER,TN,1,1,8512.0,0,2024-02-27
445210,HUNTINGDON HEALTH & REHABILITATION CENTER,TN,1,1,52156.0,0,2025-05-14
445220,SPRING GATE REHAB & HEALTHCARE CENTER,TN,3,2,128974.0,1,2025-04-30
445221,THE KINGS DAUGHTERS AND SONS,TN,2,2,13498.0,0,2023-10-05
445237,CHURCH HILL POST-ACUTE AND REHABILITATION CENTER,TN,2,1,250780.0,1,2024-11-18
445239,LIFE CARE CENTER OF MORGAN COUNTY,TN,2,2,8512.0,0,2024-09-17
445240,LIFE CARE CENTER OF RED BANK,TN,1,1,8512.0,0,2024-02-29
445242,GREYSTONE HEALTH CARE CENTER,TN,1,1,15041.0,0,2024-07-31
445245,FOOTHILLS TRANSITIONAL CARE AND REHABILITATION,TN,2,2,17883.0,0,2025-02-18
445246,JEFFERSON CITY HEALTH AND REHAB CENTER,TN,1,1,8788.0,0,2025-06-10
445251,Waverly Hills Post Acute,TN,1,1,48110.0,0,2023-08-17
445254,ONEIDA NURSING AND REHAB CENTER,TN,1,1,52111.0,0,2023-09-22
445256,HARTSVILLE CONVALESCENT CENTER,TN,2,2,16796.0,0,2025-08-11
445259,ROCKY TOP CARE CENTER,TN,1,1,86768.0,0,2024-08-22
445260,DIVERSICARE OF OAK RIDGE,TN,2,1,205329.0,1,2023-09-22
445262,EATON CREEK POST ACUTE,TN,4,3,122242.0,1,2025-02-06
445263,TRI STATE HEALTH AND REHABILITATION CENTER,TN,2,2,14852.0,0,2024-09-26
445264,LAUGHLIN HEALTH CARE CENTER,TN,3,2,9770.0,1,2023-10-05
445267,GREEN HILLS CENTER FOR REHABILITATION AND HEALING,TN,3,2,16801.0,1,2024-02-05
445270,TENNESSEE VETERANS HOME,TN,2,1,193155.0,1,2024-05-30
445274,CAMDEN HEALTHCARE & REHAB CENTER,TN,1,1,105447.0,0,2024-04-17
445276,CUMBERLAND VILLAGE CARE,TN,1,1,18769.0,0,2024-09-11
445277,STARR REGIONAL HEALTH & REHABILITATION,TN,2,2,8697.0,0,2024-02-06
445286,FAIRPARK HEALTH AND REHABILITATION,TN,1,1,27771.0,0,2023-08-12
445288,HUNTSVILLE POST-ACUTE AND REHABILITATION CENTER,TN,1,1,9062.0,0,2024-05-03
445291,ERWIN HEALTH CARE CENTER,TN,2,2,10024.0,0,2024-05-17
445292,BEECH TREE HEALTH AND REHABILITATION,TN,2,1,138802.0,1,2024-04-11
445295,HOLSTON REHABILITATION AND CARE CENTER,TN,1,1,16720.0,0,2025-11-17
445302,LIFE CARE CENTER OF ELIZABETHTON,TN,1,1,10036.0,0,2024-02-29
445306,SIGNATURE HEALTH OF PORTLAND REHAB & WELLNESS CENT,TN,6,5,199846.0,1,2025-12-04
445318,"THE WATERS OF CHEATHAM, LLC",TN,2,2,6350.0,0,2023-10-23
445331,GRACELAND REHABILITATION AND NURSING CARE CENTER,TN,3,2,342603.0,1,2025-05-13
445343,SIGNATURE HEALTHCARE OF SOUTH PITTSBURG REHAB & WE,TN,2,2,20050.0,0,2024-10-16
445351,SIGNATURE HEALTHCARE OF GREENEVILLE,TN,1,1,9419.0,0,2024-06-06
445354,LAUDERDALE COMMUNITY LIVING CENTER,TN,2,2,43644.0,0,2025-08-14
445372,HARDIN COUNTY NH,TN,3,2,67490.0,1,2025-01-23
445374,MT PLEASANT HEALTHCARE AND REHABILITATION,TN,1,1,7443.0,0,2023-09-20
445377,SIGNATURE HEALTHCARE OF ERIN,TN,1,1,147898.0,0,2024-04-03
445381,UNION CITY HEALTH AND REHABILITATION,TN,1,1,10348.0,0,2025-08-21
445382,SMOKY MOUNTAIN POST-ACUTE AND REHABILITATION CENTE,TN,3,2,61180.0,1,2024-04-05
445387,PARKWAY HEALTH AND REHABILITATION CENTER,TN,4,2,139562.0,2,2024-08-21
445393,SIGNATURE HEALTHCARE OF MONTEAGLE REHAB & WELLNESS,TN,2,2,39507.0,0,2024-07-31
445411,APPLINGWOOD POST ACUTE,TN,1,1,63999.0,0,2025-08-12
445412,MAPLEWOOD HEALTH CARE CENTER,TN,1,1,93678.0,0,2025-01-15
445413,LAURELWOOD HEALTH CARE CENTER,TN,3,2,168961.0,1,2026-01-22
445422,ETOWAH HEALTH AND REHABILITATION,TN,3,3,21692.0,0,2023-10-25
445423,VANAYER SENIOR LIVING AND REHABILITATION,TN,1,1,8589.0,0,2025-02-11
445425,MILLINGTON HEALTHCARE CENTER,TN,3,3,228371.0,0,2025-03-27
445426,SHELBY OAKS POST ACUTE,TN,2,2,83589.0,0,2025-09-30
445431,LEXINGTON POST ACUTE,TN,2,2,15470.0,0,2024-12-23
445437,WEAKLEY REHABILITATION AND NURSING CENTER,TN,3,2,72917.0,1,2025-09-10
445439,Cedar Creek Post Acute,TN,2,1,211244.0,1,2024-04-11
445440,GALLAWAY HEALTH AND REHAB,TN,1,1,78741.0,0,2025-08-27
445442,AHC CRESTVIEW,TN,2,1,10033.0,1,2024-04-26
445448,SIGNATURE HEALTHCARE OF CLARKSVILLE,TN,1,1,63105.0,0,2025-05-28
445449,Westwood Nursing and Rehabilitation,TN,1,1,9620.0,0,2025-06-18
445453,CYPRESS GROVE POST ACUTE,TN,1,1,17355.0,0,2024-09-25
445461,MAGNOLIA CREEK NURSING AND REHABILITATION,TN,1,1,16985.0,0,2025-08-12
445462,Patriot Health and Rehabilitation Center,TN,1,1,29091.0,0,2025-01-27
445467,ALAMO NURSING AND REHABILITATION CENTER,TN,2,1,12542.0,1,2024-03-15
445471,Henderson Health And Rehabilitation Center,TN,1,1,81328.0,0,2023-12-04
445479,LIFE CARE CENTER OF GRAY,TN,1,1,10039.0,0,2024-04-12
445480,THE WATERS OF SPRINGFIELD LLC,TN,2,2,35552.0,0,2026-02-23
445481,ASBURY PLACE KINGSPORT,TN,5,5,23604.0,0,2024-02-20
445482,THE VILLAGE AT GERMANTOWN,TN,1,1,11196.0,0,2025-09-11
445485,Delta Blues Health & Rehabilitation,TN,1,1,8281.0,0,2025-10-02
445489,HUMPHREYS COUNTY CARE AND REHABILITATION,TN,2,2,14013.0,0,2025-09-04
445490,AVE MARIA HOME,TN,3,2,27921.0,1,2024-03-28
445491,THE MCKENDREE POST ACUTE & REHABILITATION,TN,2,1,252242.0,1,2023-10-03
445492,Ripley Healthcare And Rehab Center,TN,1,1,66472.0,0,2025-06-05
445502,"THE WATERS OF SMYRNA, LLC",TN,2,1,97773.0,1,2024-06-21
445503,PERRY COUNTY NURSING HOME,TN,1,1,15593.0,0,2023-08-01
445508,OBION COUNTY NURSING HOME,TN,2,2,23963.0,0,2025-06-26
445509,LIFE CARE CENTER OF OLD HICKORY VILLAGE,TN,1,1,8788.0,0,2025-10-09
445510,WHARTON NURSING HOME,TN,2,2,69885.0,0,2024-05-24
445520,LIFE CARE CENTER OF BLOUNT COUNTY,TN,1,1,8018.0,0,2024-07-10
445522,WATERS OF MEMPHIS A REHABILITATION & NURSING CTR,TN,1,1,5293.0,0,2023-09-18
445526,HEARTLAND,TN,2,1,7901.0,1,2023-09-28
445538,ADVANCED HEALTH CARE OF NASHVILLE,TN,7,6,125508.0,1,2024-10-02
445539,CHRISTIAN CARE CENTER OF MEDINA,TN,3,3,15592.0,0,2024-01-02
445541,THE SUITES AT JORDAN RIVER,TN,5,5,22231.0,0,2023-08-14
455001,Avir at Beaumont,TX,3,3,52494.0,0,2025-06-20
455020,Avir at New Braunfels,TX,6,5,163618.0,1,2026-04-24
455333,Sharpville Residence and Rehabilitation Center,TX,1,1,8431.0,0,2025-07-29
455351,Legacy Nursing and Rehabilitation,TX,1,1,12375.0,0,2026-01-15
455390,Buena Vida Nursing and Rehab-San Antonio,TX,3,3,269060.0,0,2026-02-13
455412,Brookhaven Nursing and Rehabilitation Center,TX,3,3,24739.0,0,2025-08-27
455416,Willow Ridge Wellness & Rehabilitation,TX,7,7,354732.0,0,2025-08-15
455423,Mesa Hills Post Acute,TX,1,1,5734.0,0,2025-04-17
455429,Avir at Rose Trail,TX,6,6,520257.0,0,2025-08-15
455444,MESA VISTA INN HEALTH CENTER,TX,1,1,8160.0,0,2024-12-20
455450,Meridian Care Monte Vista,TX,2,2,28345.0,0,2026-03-20
455455,MERIDIAN CARE OF ALICE,TX,1,1,195635.0,0,2026-03-27
455457,Fort Worth Wellness & Rehabilitation,TX,1,1,122226.0,0,2025-07-17
455463,The Meadows Health and Rehabilitation Center,TX,3,2,35731.0,1,2024-12-06
455467,Broadway Nursing & Rehabilitation,TX,3,2,99242.0,1,2025-08-23
455471,Mountain View Health & Rehabilitation,TX,4,3,127645.0,1,2025-11-17
455475,WHITE SETTLEMENT NURSING CENTER,TX,2,2,23010.0,0,2025-02-15
455478,Ivy Creek Wellness & Rehabilitation,TX,2,2,149039.0,0,2025-04-16
455485,AVIR AT PETAL HILL,TX,3,2,53823.0,1,2025-11-11
455486,Ennis Care Center,TX,4,3,187220.0,1,2025-05-19
455489,Avir at Jeffrey Place,TX,3,2,22301.0,1,2025-07-11
455490,The Lakes at Texas City,TX,1,1,8410.0,0,2025-11-24
455493,Vista Hills Health Care Center,TX,2,1,40465.0,1,2024-12-05
455494,GLENVIEW WELLNESS & REHABILITATION,TX,2,2,23970.0,0,2024-03-28
455503,Rosewood Heights,TX,3,3,42298.0,0,2026-04-17
455510,Castle Hills Rehabilitation and Care Center,TX,5,5,117166.0,0,2025-09-12
455513,Lampasas Nursing and Rehabilitation Center,TX,2,2,33198.0,0,2025-11-23
455515,Copperas Cove Nursing & Rehabilitation,TX,2,2,23966.0,0,2025-07-30
455522,Avir at Temple West,TX,1,1,7257.0,0,2025-05-01
455528,Laredo West Nursing and Rehabilitation Center,TX,2,2,49719.0,0,2025-08-14
455532,Pleasant Springs Healthcare Center,TX,3,3,50375.0,0,2026-02-23
455533,WINDCREST NURSING AND REHABILITATION,TX,4,4,199073.0,0,2025-07-31
455538,MAGNOLIA MANOR,TX,2,2,230279.0,0,2025-03-11
455549,Jourdanton Nursing and Rehabilitation,TX,2,2,28334.0,0,2024-10-04
455550,Avir at Center,TX,1,1,9113.0,0,2025-03-26
455551,PLAINVIEW HEALTHCARE CENTER,TX,1,1,19190.0,0,2024-09-20
455554,McGregor Wellness & Rehabilitation,TX,2,2,49443.0,0,2024-04-15
455557,The Palms Nursing & Rehabilitation,TX,4,4,79987.0,0,2024-11-06
455560,MCALLEN NURSING CENTER,TX,2,2,17459.0,0,2024-10-28
455563,DENISON NURSING AND REHAB,TX,1,1,8281.0,0,2025-05-16
455565,Avir at Town Creek,TX,4,3,76268.0,1,2025-02-03
455569,HERITAGE AT LONGVIEW HEALTHCARE CENTER,TX,2,2,81752.0,0,2025-02-19
455572,WEDGEWOOD NURSING HOME,TX,3,2,31778.0,1,2025-01-31
455573,Texoma Healthcare Center,TX,1,1,16441.0,0,2025-06-18
455574,Avir at Weatherford,TX,2,2,34394.0,0,2026-01-12
455575,Windsor Nursing and Rehabilitation Center of Morga,TX,2,2,16003.0,0,2023-12-16
455576,RICHLAND HILLS REHABILITATION AND HEALTHCARE CENTE,TX,2,2,15633.0,0,2023-11-21
455579,SULPHUR SPRINGS HEALTH AND REHABILITATION,TX,1,1,44044.0,0,2024-12-12
455582,PARADIGM AT BAY CITY,TX,1,1,50359.0,0,2023-08-03
455589,FORTRESS NURSING AND REHABILITATION,TX,1,1,17014.0,0,2024-03-13
455591,Focused Care of Waxahachie,TX,4,3,179059.0,1,2026-03-02
455592,WEST SIDE CAMPUS OF CARE,TX,3,3,31279.0,0,2025-05-08
455594,PARADIGM AT KOUNTZE,TX,1,1,16801.0,0,2024-07-25
455597,MEMORIAL MEDICAL NURSING CENTER,TX,2,2,35396.0,0,2024-09-08
455599,Heritage Park Rehabilitation and Skilled Nursing C,TX,5,5,55790.0,0,2025-10-14
455601,Alvarado Meadows Nursing & Rehabilitation,TX,6,5,85479.0,1,2025-06-10
455602,WESTERN HILLS HEALTHCARE RESIDENCE,TX,2,1,62078.0,1,2024-03-25
455606,Park View Care Center,TX,6,6,299019.0,0,2025-07-16
455617,Christian Care Communities and Services Mesquite,TX,2,2,28941.0,0,2025-08-13
455618,Eden Home,TX,2,1,22205.0,1,2024-06-27
455621,Valley Grande Manor,TX,4,4,88679.0,0,2025-07-25
455625,Alta Vista Rehabilitation and Healthcare,TX,1,1,14433.0,0,2023-09-22
455626,Oakmont Guest Care Center,TX,3,3,28792.0,0,2024-09-04
455627,Denton Village by PureHealth,TX,1,1,54181.0,0,2025-09-19
455631,Colonial Manor Nursing Center,TX,2,2,60239.0,0,2026-02-13
455637,Wellington Rehabilitation and Healthcare,TX,3,3,36734.0,0,2026-02-17
455638,Greenview Nursing and Rehabilitation,TX,6,4,50213.0,2,2025-04-21
455642,DAYTON NURSING AND REHABILITATION,TX,3,3,139967.0,0,2025-09-17
455643,AVIR AT BAY CITY,TX,2,2,23689.0,0,2024-02-26
455651,DOWNTOWN HEALTH AND REHABILITATION CENTER,TX,3,3,36418.0,0,2024-12-19
455653,SKYLINE NURSING CENTER,TX,1,1,96817.0,0,2023-08-01
455662,Windsor Nursing and Rehabilitation Center of Mcall,TX,1,1,24083.0,0,2025-11-21
455670,Ridgecrest Retirement and Healthcare Community,TX,1,1,14267.0,0,2025-06-15
455672,Golden Palms Rehabilitation and Retirement,TX,3,3,15997.0,0,2025-01-25
455673,PARKWOOD IN THE PINES,TX,2,2,21473.0,0,2024-10-07
455675,LANDMARK OF AMARILLO REHABILITATION AND NURSING CE,TX,1,1,147878.0,0,2023-11-09
455676,Community Care Center of Hondo,TX,2,2,19096.0,0,2025-04-26
455678,AVIR AT LONGVIEW,TX,2,2,262731.0,0,2024-03-29
455682,Afton Oaks Nursing and Rehabilitation Center,TX,4,4,115295.0,0,2026-01-14
455684,Longview Hill Nursing and Rehabilitation Center,TX,3,3,225427.0,0,2025-05-16
455687,Alameda Oaks Nursing Center,TX,1,1,14901.0,0,2025-03-06
455689,SAN PEDRO MANOR,TX,3,2,24285.0,1,2024-06-27
455697,AVIR AT CORPUS CHRISTI,TX,1,1,14069.0,0,2025-03-26
455699,Paradigm at the Creek,TX,4,4,52034.0,0,2025-08-04
455700,WILLOWBROOK NURSING CENTER,TX,1,1,153439.0,0,2025-03-19
455703,Oakmont Healthcare and Rehabilitation Center of Ka,TX,1,1,12740.0,0,2025-10-06
455713,Avir at San Antonio,TX,3,3,39971.0,0,2025-08-30
455714,Paradigm Northwest,TX,4,4,51400.0,0,2025-08-05
455715,Monument Rehabilitation and Nursing Center,TX,1,1,8281.0,0,2025-07-02
455718,Pebble Creek Nursing Center,TX,3,2,218960.0,1,2025-05-20
455724,Arbor View Nursing & Rehabilitation,TX,6,5,203774.0,1,2025-07-31
455725,Oakmont Healthcare and Rehabilitation of Humble,TX,6,3,418615.0,3,2024-11-02
455727,Park Village Healthcare and Rehabilitation,TX,6,6,221389.0,0,2025-10-01
455731,Advanced Health & Rehab Center of Garland,TX,3,3,237224.0,0,2026-01-05
455732,Kirkwood Manor,TX,1,1,29026.0,0,2024-03-24
455733,HERITAGE AT TURNER PARK HEALTH & REHAB,TX,3,2,17493.0,1,2024-06-06
455742,THE LEV AT SAN ANTONIO,TX,2,1,174496.0,1,2024-08-30
455744,AVIR AT STEPHENVILLE,TX,2,1,204614.0,1,2024-06-14
455745,Timberwood Nursing and Rehabilitation Center,TX,1,1,8021.0,0,2024-09-12
455748,Ashford Hall,TX,4,4,301255.0,0,2026-03-04
455754,Northeast Rehabilitation and Healthcare Center,TX,2,2,24025.0,0,2026-03-19
455757,SPINDLETOP HILL NURSING & REHAB CENTER,TX,3,3,128948.0,0,2025-07-30
455761,MISSION NURSING & REHABILITATION CENTER,TX,1,1,8190.0,0,2023-10-06
455762,SAN ANTONIO WELLNESS & REHABILITATION,TX,2,1,104627.0,1,2023-12-03
455763,PARK BEND REHABILITATION AND HEALTHCARE CENTER,TX,4,4,271990.0,0,2026-03-11
455770,OAK BEND MEDICAL CENTER,TX,3,3,17560.0,0,2024-01-08
455771,HEARTHSTONE NURSING AND REHABILITATION,TX,3,3,152617.0,0,2024-12-19
455785,Avir at Western Hills,TX,2,2,16562.0,0,2025-11-20
455789,OAK PARK NURSING AND REHABILITATION CENTER,TX,1,1,9280.0,0,2024-11-12
455796,Town and Country Nursing and Rehabilitation Center,TX,2,2,150922.0,0,2024-07-26
455797,Pearsall Nursing and Rehabilitation Center,TX,1,1,21930.0,0,2025-05-09
455798,BEDFORD WELLNESS & REHABILITATION,TX,2,2,25782.0,0,2024-09-13
455799,AUSTIN WELLNESS & REHABILITATION,TX,3,3,166205.0,0,2024-09-19
455800,The Lev At town Park,TX,1,1,47740.0,0,2025-11-17
455802,Spanish Meadows,TX,3,2,14790.0,1,2024-10-17
455804,NORTHGATE HEALTH AND REHABILITATION CENTER,TX,2,1,27710.0,1,2024-04-14
455806,THE TERRACE AT DENISON,TX,1,1,47097.0,0,2024-08-12
455808,AVIR AT JACKSBORO,TX,1,1,23813.0,0,2023-08-26
455812,PARADIGM AT FIRST COLONY,TX,3,3,211113.0,0,2024-11-27
455815,Fallbrook Rehabilitation and Care Center,TX,4,3,185939.0,1,2026-02-27
455817,San Antonio North Nursing and Rehabilitation,TX,6,4,60140.0,2,2024-05-28
455819,Arlington Heights Health and Rehabilitation Center,TX,3,3,31539.0,0,2025-09-05
455823,Treemont Healthcare and Rehabilitation Center,TX,4,4,69954.0,0,2026-03-17
455824,WURZBACH NURSING AND REHABILITATION,TX,3,3,34945.0,0,2025-03-09
455831,Avir at Paris,TX,2,1,136756.0,1,2023-08-06
455832,WINDSOR GARDENS,TX,1,1,13877.0,0,2024-06-11
455834,Avir at Athens,TX,4,4,243325.0,0,2024-11-26
455835,Interlochen Health and Rehabilitation Center,TX,3,3,54137.0,0,2025-04-24
455838,ROBSTOWN NURSING AND REHABILITATION CENTER,TX,1,1,12055.0,0,2024-02-23
455850,HURST PLAZA NURSING & REHAB,TX,1,1,6540.0,0,2023-12-26
455855,Kennedy Health & Rehab,TX,5,4,268507.0,1,2025-12-03
455861,Landmark of Plano Rehabilitation and Nursing Cente,TX,2,2,79867.0,0,2025-02-04
455862,Coral Rehabilitation and Nursing of Austin,TX,10,6,307414.0,4,2025-12-10
455864,LIFE CARE CENTER OF PLANO,TX,1,1,8281.0,0,2025-04-24
455866,BROOKDALE WESTLAKE HILLS,TX,6,6,300561.0,0,2024-05-01
455869,GUADALUPE VALLEY NURSING AND REHABILITATION CENTER,TX,1,1,75450.0,0,2024-04-26
455871,Lynwood Nursing and Rehabilitation,TX,1,1,8281.0,0,2025-09-03
455872,ARLINGTON RESIDENCE AND REHABILITATION CENTER,TX,7,6,111622.0,1,2025-02-06
455876,The Woodlands Nursing and Rehabilitation Center,TX,2,2,23977.0,0,2026-04-13
455879,Marshall Manor West,TX,1,1,21530.0,0,2025-10-22
455881,DFW Nursing & Rehab,TX,8,6,317302.0,2,2025-08-01
455889,Lily Springs Rehabilitation and Healthcare Center,TX,3,3,86207.0,0,2025-04-12
455891,RENAISSANCE PARK MULTI CARE CENTER,TX,4,4,106478.0,0,2025-02-28
455893,Grace Care Center of Henrietta,TX,3,2,306719.0,1,2025-04-25
455895,Five Points at Lake Highlands Nursing and Rehab,TX,5,5,72424.0,0,2025-12-11
455900,Focused Care at Mount Pleasant,TX,7,5,240688.0,2,2025-06-25
455903,Lake Lodge Nursing & Rehabilitation,TX,3,3,47621.0,0,2024-05-23
455908,Schulenburg Regency Nursing Center,TX,2,1,8827.0,1,2024-12-13
455915,Granbury Care Center,TX,2,2,37501.0,0,2025-09-12
455917,Deer Creek Nursing and Rehabilitation,TX,4,4,75581.0,0,2025-09-29
455923,Avir at Beeville,TX,1,1,38687.0,0,2024-06-16
455925,VERANDA REHABILITATION AND HEALTHCARE,TX,1,1,8021.0,0,2024-04-12
455930,CEDAR RIDGE REHABILITATION AND HEALTHCARE CENTER,TX,1,1,13628.0,0,2023-07-12
455935,EL PASO HEALTH & REHABILITATION CENTER,TX,2,1,20312.0,1,2023-09-01
455936,FOCUSED CARE AT LAMESA,TX,1,1,10692.0,0,2023-11-22
455940,Avir at Lubbock,TX,4,4,69168.0,0,2025-09-05
455941,Avir at Enchanted Rock,TX,2,2,63121.0,0,2025-01-19
455944,FOCUSED CARE AT CLARKSVILLE,TX,1,1,5211.0,0,2024-10-05
455952,CLEVELAND HEALTH CARE CENTER,TX,2,2,30198.0,0,2024-08-29
455959,WESTWARD TRAILS NURSING AND REHABILITATION,TX,3,3,33060.0,0,2025-06-25
455960,HAYS NURSING AND REHABILITATION CENTER,TX,1,1,8226.0,0,2024-05-02
455961,PALO PINTO NURSING CENTER,TX,1,1,41036.0,0,2024-08-25
455962,Avir at Kaufman,TX,1,1,8021.0,0,2024-08-07
455963,AVIR AT CARTHAGE,TX,4,4,79390.0,0,2025-07-14
455968,Graham Oaks Care Center,TX,2,2,34690.0,0,2025-10-10
455969,PATRIOT HEIGHTS HEALTH CARE CENTER,TX,2,2,27805.0,0,2025-10-31
455974,ROCKPORT NURSING AND REHABILITATION CENTER,TX,1,1,20088.0,0,2023-07-14
455983,St. Catherine Center,TX,1,1,13065.0,0,2026-04-30
455986,HENDERSON HEALTH & REHABILITATION CENTER,TX,1,1,10358.0,0,2025-09-17
455989,Avir at Borger,TX,4,2,40307.0,2,2025-08-27
455994,DESOTO NURSING & REHABILITATION CENTER,TX,1,1,12740.0,0,2026-02-12
455996,THE RENAISSANCE AT KESSLER PARK,TX,1,1,11031.0,0,2024-07-25
45F094,REAGAN COUNTY CARE CENTER,TX,19,19,123755.0,0,2024-02-20
465003,Heritage Park Healthcare and Rehabilitation,UT,1,1,36645.0,0,2024-07-02
465006,Mt. Olympus Rehabilitation Center,UT,5,5,149703.0,0,2025-10-24
465020,Monument Healthcare Pioneer Trail,UT,2,2,19747.0,0,2025-04-03
465049,Spring Creek Healthcare Center,UT,2,1,53472.0,1,2024-01-11
465057,Four Corners Regional Care Center,UT,2,1,68471.0,1,2025-01-09
465059,Mission at Richfield Nursing and Rehabilitation,UT,1,1,8148.0,0,2024-02-07
465066,Monument Healthcare Taylorsville,UT,1,1,7525.0,0,2024-03-12
465067,Rocky Mountain Care- Clearfield,UT,1,1,58637.0,0,2024-04-17
465074,Monument Healthcare Cottonwood Creek,UT,1,1,17940.0,0,2024-04-04
465075,Rocky Mountain Care - Hunter Hollow,UT,1,1,20318.0,0,2023-10-26
465079,Sunshine Terrace Skilled Nursing,UT,1,0,0.0,1,2026-04-13
465083,Crestwood Rehabilitation and Nursing,UT,1,1,10839.0,0,2024-01-29
465085,San Rafael Health and Rehabilitation,UT,2,2,29347.0,0,2024-11-15
465086,Mountain View Health Services,UT,5,3,177591.0,2,2026-01-08
465088,Mission at Alpine Rehabilitation Center,UT,2,2,125737.0,0,2025-08-20
465089,Rocky Mountain Care - Willow Springs,UT,2,2,40892.0,0,2025-06-17
465090,Cascades at Orchard Park,UT,1,1,11992.0,0,2023-10-19
465092,Uintah Health Care Special Service District,UT,1,1,28038.0,0,2025-09-25
465093,Monument Healthcare Brigham City,UT,1,1,15640.0,0,2025-12-03
465094,Monument Healthcare Murray Creek,UT,2,2,120948.0,0,2025-06-28
465096,Monument Healthcare Canyon Rim,UT,1,1,6676.0,0,2024-12-16
465097,Monument Healthcare American Fork,UT,1,1,35437.0,0,2023-12-06
465100,Paramount Health and Rehabilitation,UT,2,2,119012.0,0,2025-12-15
465101,Hurricane Health and Rehabilitation,UT,2,2,46602.0,0,2025-09-25
465102,Parkdale Health and Rehab,UT,1,1,6351.0,0,2023-09-05
465104,Orem Rehabilitation and Nursing Center,UT,1,1,38357.0,0,2023-07-18
465111,Sandy Health and Rehab,UT,4,3,89798.0,1,2024-08-15
465112,Monument Healthcare Bountiful,UT,4,3,68994.0,1,2025-11-06
465117,South Ogden Post-Acute (Cascades at South Ogden),UT,5,3,68891.0,2,2024-09-16
465119,Provo Rehabilitation and Nursing,UT,2,2,82617.0,0,2026-03-16
465125,Rocky Mountain Care - Cottage on Vine,UT,3,2,78946.0,1,2023-11-08
